names,reviewtitles,ratings,reviews
Sahil Zedi,Premium sound quality for such low price.,5,Best gaming experience I've had so far with the sound quality this headset provides.Pros:1. Build Quality2. Premium Sound Quality3. Virtual Surround Sound4. Microphone is pretty good.5. Noise cancellation works pretty good.6. Dedicated BOAT Plugin application for management.7. Extra Loudness Lvl .Cons:1. Mic has to be close to mouth to work properly.2. Boat plugin application conflicts with sound drivers on some systems.
Justarandomguy,7.1surround,4,It is amazing how this head phone has 7.1surround and is cheap I was looking for 7.1 surround wireless headphones but the. I saw this one it has loads of amazing features specialy the boat plugin we can customize loads of thing inbuilt voice changer and you can even moniter your audio and all of that on just under 1.5k rupees
prasad Nandakumar pawar,Best Gaming Headphones @ 1499,5,"The media could not be loaded.
                



 These are the best gaming headphones for the pricePros :-1. 50 mm drivers sounds the best I've listened to other 50mm driver headphones and these sounds the loudest even at 70-75% you are good to go2. Top notch microphone sounds crystal clear and on top software customisation allows you to reduce background noice marginally3. Light weight at 380gm can't even feel they are on your head used them for almost 3 hours and no pain on ears at all although there is little sweating around ears but that's fine4. long 2m cable red colour braided looks awesome and feels durable and sturdy5. Software installation allows you to enable 7.1 surround sound there is slightly difference between normal and a 7.1 surround you can tell the sound where it's coming from marginally than normal stereo mode ( download software from bota immortal 200 page on boat official website of scan the QR code from mannual)6.Rgb looks sutel it has smooth breathing effect looks niceOverall great buy for 1499 I'll suggest go with boat rather than spending tom more for eksa e900"
zubi zubair,Osm,4,The media could not be loaded.
Arka,Put it on baby!,5,So my previous headphone was destroyed for some xyz reasons and I bought this one cuz i was searching one on budget and then i got my hands on this beast. Even though the price is  low the 7.1 surround sound is hella segsy and provided ur a budget gamer like me this is a bliss and nevertheless a good choice for playing fps games for better sound and hearing but in the end the decision is yours.
Sharad S.,Superb headphone,5,Product is bigger than it seems in photos.Using this for WFH.Volume is excellent.There is a volume controller in headset itself.It is a plug and play device as PC USB automatically detects it and downloads required software.Brought it for Rs 999 only.
Yousuf,Good product,4,I liked the product. Bought it for meetings not for gaming. Only thing missing is button to mute. I have to do it manually through software. Overall good product
yogesh mote,Best product,4,Good quality product
Sahithi,Hurts ears but good sound quality,3,"After trying the product for a month, I can tell that this is not a product if you have to wear it for long hours, my ears hurt. Headphones are very heavy. My advise is, if you don't use it for more than 2 hours at a stretch get them. I regret buying them, cause I need them for 8 to 10 hours and my ears hate having them on"
Sibsankar De,This headphone is very good for gamers as it has a wonderful and useful microphone.,4,This headphone is very good for gamers as it has a wonderful and useful microphone. It records voice in a beautiful way. In fan it can't record fan sound but records my sound. But one problem is that it cannot expand. Overall this is a very good headphone.
Harshil Chaudhary,Unbelievable🤩👍,5,Expensive and value for money
Mukesh,The ear feel hot due to the ear cover,4,Ear covers are very big and air restricted so I feel very hot in my ear but sound and other quality is good.
Pankaj,A phenomenal 7.1Ch surround sound experience,5,"Initial impressions... The packaging is just phenomenal, I loved the way they've packed it, the unboxing experience was great.One of the best budget 7.1Ch headsets from a reputed brand. They're stylish and have a very neutral sound profile, well-suited for lots of audio content. While they lack more advanced sound modification options, its companion app does have a few EQ presets that you may tweak according to your preference.Despite the fact that these headphones have a very comfortable and stable fit, it will take you a day or two to get used to them. They're also well-made and have the sensation of a 7.1-channel headset. The cable is braided and pretty long. The noise-canceling is decent, and the RGB is permanently set to breathing mode. The microphone is omni-directional and of excellent quality; it also includes a small pop filter that greatly reduces wind noise.It's made of ABS and appears to be quite durable. Above the RGB lights, the metal mesh has been placed to give it a more robust appearance. The left earpiece has volume control.Overall, I think it's a great price; but, the software could have been better."
GURU prasad,My review,4,"I used this for a month till now its an amazing budget gaming headphone , but sometimes it creates pain around ears , except that its amazing budget gaming headphone"
Ananth,Great looking headphone for the price,4,"Its a good headset with great looks also but the image shown in the product section is a bit incorrect as there is a silver coloured grill over the boat logo, also the texture of the product is not same as the above-mentioned image. As for the comfort, my ears do have a bit of pain, maybe it might go after I get used to them. They have ok sound quality nothing spectacular but for the price i would say its good"
Pratham dave,Really Good in this price segment,5,"Around 1500 i guess this would one of the best headset in terms of build quality and overall feelThe headsets are really light as compared to other gaming headsetsThe earcup just over the ears really well,Audio profile is really sub-pa,r Bass is not that goodIf you compare this to the likes of Redgear Cosmos this doesn't have that thump, but the sound quality is really nice it has good vocals and sound seperation is really nice, 7.1 surrounding is a gimmick as of any budget 7.1 doesn't work till you use a sound card or a EQ.The mic is reasonably good but the sound isolation is excellent and the drivers provided gives so many features as we can polish the mic input sensitivity and the output volume which is A+.Overall a very good headphones around the price .And the biggest reason i bought this is because the brand quality of Boat itself as they provided some excellent customer service in the past , and i guess this is the best brand to buy gaming headphones at this price segment ."
Niraj,Amazing Gaming Headphone from boAt,5,"First of all on time Delivery and the packing was super cool .. About Headphone really was looking for budget and good headphone from long time and this Boat headphone is Super cool sound is damn nice and you can easily hear footsteps, the Rgb lights are also good it has 7.1 Surround sound ..Really good headphone in this budget just go for it …."
joy,All good but one thing.......,4,All good but one thing cracked me up. THE BASS. Not convincing at all. No Sir.
Anonymous,Breaks Easily,3,"The media could not be loaded.
                



 I purchased this a few months back but now it broke on its own it just came out literally nothing was done to it, I think I got a faulty product please help."
Meghalaya,worst mic attachement,3,"ive used it for around 10 hours and what i've found is the mic doesnot stay in the position where we set it. it goes away from the mouth in the opposite direction as if someone is pulling it. another con is that the ear muffs are rexin like material which makes you easily sweat within an hour of usage. n coming to sound quality the audio is quite loud but in terms of base its below average.there is no in line controller or any switch so that we could control the mic and rgb.its just bresthing rgb which is outdated in terms of looks.it feels quite heavy and the strap which comes over the head,it doesnot have enough strength to hold on and keep it in position. after 10 mins of usage the ear muffs are pushed down and taking support of my ears which is painful. for the price point its not so worth it. spend a bit more and go for redgear cosmo."
ATHARVA TANDEL,For the price of 1300 it is real good,5,It has real good stereo sound good for gaming. I play valorant now and then and the surround sound is quite clear. As for music not that great bass or maybe u haven't configured it yet but the treble and volume is more than enough at just 50 percent volume on windows. So that's great too
Deepesh Roy,Improve needed,3,"The comfort in the headphones are not good enough at the price range and the software functions are also not the best mic started glitching after a month , improve needed, but the costume service is perfect they replaced my product under warrant and fixed the mic issue"
Karthik,Value for money great built no compromise in the built quality.,4,Too much bass good for gaming the headset is not breathable ears starts sweating after an hour of usage. Sound quality is good for the price. Weight is a bit of a concern. I would recommend mid level gammer to use this to save some bucks.
Abhishek,Definitely worth buying,5,"The media could not be loaded.
                



 Bought this product for Rs1499/- and i'm pretty sure this headphone will give you an awsome experience in gaming.It looks quite bulky and attractive. Complete structure is made of metal and plastic. Headrest is of metal and headsupport is of leather.Earcups are very soft and as it is made of plastic so it will fell some sweaty in summers. It has boat logo(breathing RGB) on both sides and has metal grill o it.Has USB braided cable and cable is very long(2m).Weight is less (350gm) as compare to Redgear cosmo(600gm) but it will feel quite heavy on your ears after 2-3hrs.Sound quality is awsome(clear and sharp). But as it is a gaming headset it has balanced bass. 50mm drivers works perfectly in this headset.Mic quality is very good and has noise suppression on it.Don't forget to download it's software as it has many features like 7.1 surround sound, Environment effects, ENx Technology."
Poulami,May be nice. Haven't used it as it is for laptop only. Can't use in mobile phone. Hence returned.,4,For laptop only
Bharat Bhushan Jhariya,Price to performance,5,"I bought this product on 21st of September 2021 and I am highly satisfied with it. It has some really nice audio quality, noise cancellation and in my opinion one of the best gaming headphones in this budget. I have used plenty of gaming headsets and this one is my favourite for the budget. The mic quality is very good, and its good for gaming. If you listen to music very much, I will not recommend these for only music use still its average. Overall I love this hedset, its plug and play and I am very satisfied with it."
Sourav Goswami,Best USB Headphone for Linux 🐧,5,"Best USB Headphone for Linux (using Kernel 5.15.8). The sound quality is amazing - all balanced sound. Bass is superb.Microphone quality is very good too! Not really noise cancelling, but it's appropriate for meetings in low noise areas!It uses the C-Media chipset for the USB DAC which isn't bad.The benefit of USB headphones is that it will sound the same on all devices that has USB and can provide the adequate power! So it doesn't rely on the integrated soundcard!Overall impressed. Got what I wanted!EDITWith USB OTG support, it also works on my phone (Kernel 5.14+). The sound is as usual very good quality!"
Atharva Karnik,For the price point could have been better,3,Microphone and cushion could have been better
Subesh,THE MIC AND THE BUILT QUALITY IS AWESOME,4,"THE RBG LIGHT AND VOLUMES ARE OP IN THIS HEADPHONE,THE FINISH AND THE EAR FOAMS ARE  SO SOFT AND WELL FIT,THE MIC AND THE CABLE IN BEST QUALITYTHE SOUND QULATY IS PRETY GOODI USE THIS HEADPHONE FOR GAMING,AND ALSO ONLINE CLASSESTHE LOOK IS OP 🤘🤘 AND ITS ROCKINGIF U ARE A MOBILE GAMER U WANT TO USE OTG FOR THE CONNECTIONANY WAYS THIS ONE IS A AWESOME PRODUCT IN THIS PRICE,BOAT IS ALWAYS BOAT🤘🙄🧞‍♀️🔱"
Sudharsan,More Sweating,3,This make more sweat near Ears during Gameplays!
Richard Prabhakar,Stylish and good quality for a reasonable buck,4,The comfort of the headphones was really good . I would like to say that the overall volume isn't jaw- dropping but it is really clear. The design is good .the LEDs on either side are not that bright but increase the overall look of it
RHISHIKESH SAPKAL,Bang for Buck,5,"I'm not attaching any pictures because I don't have them available as of now, however take me for my word for it this is the best possible headphone that you can get in this price range,Listing out pros and cons :Pros -1. Crisp audio quality2. comfortable around the ear, good for extended duration FYI I have it on for 8+ hours everyday3. lightweight4. Mic is flexible and durable to withstand abuse5. Rigid frameCons -1. Sound leaks out a lot if the headset is not mounted properly2. microphone does not pic up any sound if it is positioned under chin level3. no mechanical switch to turn microphone off"
RAVI,The review u wanted!,5,"this is the review. the sound quality,the virtual surround sound and the mic..they are awesome...this headphone is worth for every bucks! sound is too loud on full volume and when u enable the 7.1 sound(first u need to install the boat plugin labz to enable it ) and if u a play a battle royale game..u can hear every footstep clearly and where is someone u can also detect it..so yh..and music listening..awesome and great..when u listen to music u wont be able to hear anything from outside of u hear..so go for these headphones!!!"
aman,Ok ok in price range but with a catch,2,"First of all it has wired usb port so only for pc and laptops not for cellphone. Now coming to the pc ...when you use it for voice over during video editing there is high eco in voice over audio specially in premiere pro so for mic purpose ""just waste of money"" for me. Also the product I recieved was partially damaged. Left head side over head part was partially damaged."
Chintan Patel,Average product,3,Average product
Andrewchell,For video editing one of the best.,4,I hope good for gaming but I'm not a gamer i use it for video editing so best for one of the best gadget.
Vector Sd,Good quality 😊,5,"I bought this for meeting purpose. I was looking for an overhead headphone with mic. COSMIC-BYTE was an option. But the built quality of COSMIC-BYTE is very poor. So I opted for this BOAT 200.PROS:1. Good sound quality2. Good bass3. Mic quality amazing4. Built quality is premium5. Wire quality is good (Braided & tnagle resistant)6. RGB looks goodCONS:1. A bit heavier2. sweats the ear quite often3. Only USB connection.(No 3.5mm - use OTG for mobile usage)Thats all. Overall I think it is a worthy purchase. (8.5/10)Although, I am dissatisfied with the delivery. The package was terribly crushed & broken. Very poorly handled. The box was opened in all sides & torned. Product is good 👍. Delivery is terribly bad 👎."
Gautham,Bought it for Call of Duty Warzone ! gaming just got 10x better !,5,"Can hear enemy footsteps crystal clear and For 1499 bucks , I would call this a steal deal ! worth every penny just for the gaming features and its very comfortable ! It is worth far more than how much credit its given in the other reviews ! just go for it !"
Piyush,"very big, heavy and so uncomfortable",3,"The product is good looking but it is very big and heavy. Also very tight on the head even though my height is not that big. The sound quality is decent enough, not that great."
Gurvinder Singh,Amazing headphones by BOAT,5,Superb packaging superb sound quality superb noise cancellation function it’s up to the mark for live streaming loved it and must recommended thanks boat for making good headphones at genuine price.
Nirmal Samant,Best Gaming Headphone @1499,5,"Immortal IM-200  is such a amazing and premium quality boat headphone @1500/. It falls under a good and low price range, good to use for beginners.In this Pendamic time where the prices are continuously increasing for the products it's valuable and great to got this product under affordable range specially for PC user's and gamers.It's in round shape.Very light weight and very comfortable for ears  with professional fine finish sound.In this RGB light, which looks good to see in different lights. It comes with secure braided cable also.It comes with adjustable Mic which give clear sounds to the listeners.Headphone comes with 1 year manufacturing warranty also.Overall I would say this is good Gaming headphone for entry level under this price range. Everything is outstanding in this product."
Premlata Chugh,Its good but bass quality is less,4,"The overall headphone is very good, even the build quality...but the only thing i did not like is the bass quality. It has not a very good bass, which is only the problem. Could have been better."
Prasanth,Very good product for its price.,4,"Worth every penny. wish it was a little lighter, but will get used to it.Very good sound quality and very effective mic."
Shravan,"Mic is good, sound is fine.",4,"You can't find a better mic at this price and that's the only thing that stands out about this headphone, everything else is just okay."
Inder d.,Best Headphones at this Price,4,"These are the best headphones I hv=ave used till now, great product at such price, really good...you can use it for gaming, music prod. n video creations"
Ashiq Firoz,Great product for a Good price.,4,Noise cancellation is partial. Have good wire length. Best for pc gamers. Go for it if you are looking for the best in best affordable price.
Devasheesh S.,It's for just gaming but not that good,3,The product is good but you can't use in more than an hour because it's quite heavy and you will feel headache and on the other side it leaks audio too.So i will suggest if you have a good budget then go for a better headset. Rest is up to you.I own I for a month now so that's what my experience says
Mohammed Ibrahim,Good product,5,Working fine.If the option to mute the mic is added it will be a Perfect product
kanishk,Average product,3,Head band feels loose so the entire weight comes in the ears . Sound quality is decent .
Dhruvakumar,Good quality product best in range,5,Overall good
Jemima Johnson,Decent gaming headset,4,"If you want budget gaming headset this is the right one for you,7.1 virtual surround works decentComes with long wire so no need to worryLittle bit loose on my head and heavyMic is decent,but adjustability of mic is poorIf you want a gaming headset under 2k this is the one for youIf you want to use it on Mobile then you should invest in a USB otg cable"
Shaibaaz shaikh,Gud product,5,Gog producy and ita has a long wired which is better
Sayan ghosh,Very bassy sound,4,The media could not be loaded.
Minhaj Mohd,Headphones are really good and sound quality is awesome,5,Have been using this for office calls and the voice quality and noise cancellation is really good!Go for it!!
Vijay,Worth it,4,I like the build quality and overall sound quality is good.Noise cancelling is good the mic is decent for online classes and ingame voice chat
Adhithyan NS,value for money,4,very good productsound quality is awsomein this price range it is the best option for gamingbut you cant use more than  4 hou
Swetakant Panigrahi,Excellent product,4,Mostly sound quality is good. It had different modes. That's quite good for gaming.
Mahesh K.,Nice product but sound can be improved as per the price,4,I like the materials used. it feels premium and sits comfotably on ears.the mic is also good. But the sound quality is about disappointing and it's lacking in bass.
Somtirtha Maity,Sound is good. But too heavy. Don't buy it for WFH purpose.,3,Not for WFH purpose..go for Poly by plantronics and Jabra
Amazon Customer,Fair review,4,"Pros: build quality is very good.Comes with threaded wire.Can be used with and with out the boat 50mm drivers.Price in range of 1500Rs.Cons:No Mike control (need to control with keyboard)Mike can't be folded completelyBig in size, expect little sweat and uncomfortability.RGB lights glow always if you don't have the 50mm boat drivers installed."
Apoorva,"Not worth buying, waste of money",2,I brought this headphones two months back and already it is sent back twice under warrant replacement for microphone not working. Boat service is good but now the product is useless so I have simply wasted my money and time on this product.
BEST SETUP,Cinematic audio quality best for gaming and next level for video editing loved it,5,Nice product value for money and good features best price for under 1700 gaming beast headphone nice choice
Sourav Barat,Good and useful headset for gammers,4,This product is good for gammers but it's wearing feeling is heavy
mouli,Not good not bad as mute button not there,3,If it has mute button great
Anand yadav,All thing is very good,5,
Gourav Singh,"Nice and sturdy headphone, with a perfect microphone.",5,"Nice and sturdy headphone, with a perfect microphone that provides decent noice cancellation. Although one might feel sweaty wearing it for too long. But its a good purchase for the gamers (although I'm not one), music lovers."
Aadhithyan AS,"Everything excellent,but mic is not that gud",4,"The hearing is perfect for gaming extrem sound,quality,little pain after 1abd half hours use but mic is not that good ,bad forStreaming"
Sayan,Great buy for budget gamers,5,I purchased this product a couple of weeks ago. And it has been much better than my expectations. It's a buy worth it for budget gamers
Rohan K,Review After Using 1 Month.,4,I purchased this headphone 1 month back in a sale. This is best purchases I made for myself.Pros:Sound Quality.Mic Quality.Length of cable.USB powered.Cons:Feels heavy after hours of usage.Cable keeps tangle.
FARZAN ZAIDI,Not recommended for professional FPS gaming,3,"I'm valorant gamer im using this headphones since 6 months, not recommended for FPS gaming."
Pinaki,Budget gaming,4,"Pros -Price 1499USB connector - single connector for sound and LEDBig ear capSurround soundCons -It's not 7.1. Good for light gaming but not for proNo mic mute button. One small volume rocker but that too in the headset.Quite heavy, can't use for longer.mic adjustment is not so good."
Mukesh Senwar,Feedback to the headphone is desirable.,3,"Item at par, I have one suggestion that is has no feature of feedback Mick sound to headphone, this feature is desirable for singing song. This item has also no feature of returning and only replacement is enable. Please take the note."
Deepmala solanki,It's like best headset at this price point,5,I like as it is good for gamers who can't afford expensive headset. I prefer to buy it at best offer.
Freddy,Nice gaming headphones,4,Loved the headphones. Lovely Color and design. I can hear secrets from next door now
Placeholder,Good,5,Good
Deep dhan,Sound bleeding,4,"Build Quality-10/10Comfort-9/10Sound Quality-9.5/10Mic check-10/10Only thing which i hate the most is, the sound bleeds its like too much for my ear to handle.In a quiet room can be used as a speaker. When used for gaming pretty descent audio(when vol. is lowered), surround sound is also good."
Rayarakula Anil,Voice Changing Feature,5,wow wow.. lot of features and high quality product.. have 4 types of voices is amazing with boat lab application .. i like very much .. have full comfort with large on heads .. sound quality amazing
Saket Marodia,Worth the Price,5,This is an Amazing Product for the Price they are Charging
"M@N, kolkata",No mute 🔇,5,Like it.... Good for gamming as well wfh.. Except mute.. Option  to slow volume
Anindya,Best gaming headphone under 4k!,5,"I tried other local gaming headphones but non were good since they all gocused on bass insted of clarity , which is an exceptionally bad idea when playing any multiplayer game.This has almost similar clarity as jbl quantum 200 for less then half the price. Which is exceptionally good. The mic is also similarly very clear and crisp.If u are considering for gaming i strongly recommend this one over boat im1000d or any other headphone."
Bhavya patel,Improve Packaging,3,The sound quality is great but I don't like the packing. need to add some cushioning in that.p
Harsh agrawal,It is not per my expectations,3,The media could not be loaded.
Primel Michael,The Product is worth and its sound awesome,4,The Product is worth and its sound awesome
Aakash,An affordable gaming headphone with great sound,5,"I recieved this product two days ago, so I had time to review it in different games. Here's my opinion;Has great sound quality and fits on heads perfectly.Tried it in Valorant and San Andreas sounds were distinct and clear.Apart from game if you're watching movies it gives you immersive experience.Good microphone, make sure that you've enabled noise cancellation in BoAt Plugin LabzComing to build quality: It has good build quality.When it comes to the downside, it feels a little heavier on the head."
JITHIN MANOJ,Great one for Gaming,4,"Overall the product is great for gaming, this is not having good bass as it is not for songs it is for gaming, it will work with mobile phones  using an otg cable. The size of the headphone is bit bigger so smaller head peoples will feel it loss.."
